RideHailing,lyft,Driver,7/26/2021 14:23,john2764,had a nice ride to work  very friendly and clean car,"friendly, clean car",,ride experience,,,,,FALSE,5,,,6,"nice,ride,work,friendly,clean,car"
RideHailing,ola-cabs,Driver behaviour is not good,12/31/2021 14:45,gajala babu,"yesterday i have booked cab from rtc cross roads to kphb, the driver didn't come to actual place and asking us to come to his place as that is opposite side of the road , after 4 to 5 minutes he canceled the trip as customer delay",,"booked, driver not come, asking to come, canceled customer delay",,ride experience,,,,FALSE,1,,,26,"yesterday,booked,cab,rtc,cross,roads,kphb,driver,not,come,actual,place,asking,us,come,place,opposite,side,road,4,5,minutes,canceled,trip,customer,delay"
RideHailing,gett-business-ground-travel,Simcha is great!,5/9/2022 9:10,SLuGW,simcha arrived early. was a calm and professional driver. we had a nice conversation. 5 stars!,"arrived early, calm, professional, nice conversation",,ride experience,,,,,FALSE,5,,,10,"simcha,arrived,early,calm,professional,driver,nice,conversation,5,stars"
RideHailing,uber-request-a-ride,Stupid charges,8/24/2021 19:23,Seth018492,a driver accepted my ride while he was finishing a trip 20 miles away. found a lyft 5 mins away so i canceled. uber charged me $5 even though that driver was still driving someone else. screw this app,,"accepted ride, canceled, charged driver driving someone else",,payment reliability,,,,FALSE,1,,,26,"driver,accepted,ride,finishing,trip,20,miles,away,found,lyft,5,mins,away,canceled,uber,charged,5,even,though,driver,still,driving,someone,else,screw,app"
RideHailing,grab-superapp,Amazing app,7/15/2022 18:24,nus azouz,the app is very helpful it have everything you need with beautiful suggestions,,,,,,,,FALSE,5,,,6,"app,helpful,everything,need,beautiful,suggestions"
RideHailing,blue-bird-group-taxi-mobile,Keep it up,6/6/2022 2:40,nukker25,keep it up the service & safety. success ,,,,,,,,FALSE,5,,,4,"keep,service,safety,success"
RideHailing,lyft,Review,4/1/2021 14:26,msbizniz,sometimes my scheduled rides don't get a driver,,,,app reliability,,1,,FALSE,4,,,6,"sometimes,scheduled,rides,not,get,driver"
RideHailing,hopskipdrive,Scam,11/13/2021 22:22,Kyah118,"update: the confusion lay in that their communication system didn't correctly and identify who canceled the ride. the support team reached out to rectify what happened. 
****************************
this is a scam. they canceled the scheduled ride, and support first said i called and canceled and when i said no i sure didn't call to cancel, then they said the emergency contact called to cancel which was also not the case. don't give your information. cancelling my card just in case this is a for real scam. zero stars.",,"confusion, not correctly, support team, scam, canceled scheduled ride, dont give information",,"fraud, customer service",,,,FALSE,3,,,46,"update,confusion,lay,communication,system,not,correctly,identify,canceled,ride,support,team,reached,rectify,happened,scam,canceled,scheduled,ride,support,first,said,called,canceled,said,sure,not,call,cancel,said,emergency,contact,called,cancel,also,case,not,give,information,cancelling,card,case,real,scam,zero,stars"
RideHailing,waze-carpool,WHOOPS it says,9/4/2021 11:22,Thomas Book,"down loaded the app. i will not open all it says is whoops something went wrong. help us get better, send us feedback.  when i hit send logs it just spins and spins. until force close the app.",,"something went wrong, spins and spins, force close",,app reliability,,,,FALSE,1,,,23,"loaded,app,open,says,whoops,something,went,wrong,help,us,get,better,send,us,feedback,hit,send,logs,spins,spins,force,close,app"
RideHailing,uber-request-a-ride,Price doubled,8/16/2022 0:46,morningtwister,my ride to work usually is twice the amount its been trying to make me pay lately. almost $40 for a 7-9 minute drive!! not to mention scheduling always set price is triple the amount it is to just request one but when you have to go to work you cant rely on the whims of drivers 30 minutes away who refuse to cancel so you get charged. im so done with uber. guess lyft got another customer.,,"twice the amount, price triple the amount, cant rely, whims of drivers, refuse to cancel",,affordable,lyft,,,FALSE,1,,,44,"ride,work,usually,twice,amount,trying,make,pay,lately,almost,40,7-9,minute,drive,mention,scheduling,always,set,price,triple,amount,request,one,go,work,cant,rely,whims,drivers,30,minutes,away,refuse,cancel,get,charged,im,done,uber,guess,lyft,got,another,customer"
RideHailing,lyft,Half a gigabyte? Use a different tool.,1/12/2022 16:48,_NM_,the size of the app at 400+ mbyte is excessive.,,,,,,,,FALSE,1,,,5,"size,app,400+,mbyte,excessive"
RideHailing,ola-cabs,Maps bounce a lot. Poor user experience,5/6/2022 16:23,rtilekar,"the bottomsheet should remain intact irrespective changing local or outstation tabs. lot of reloading maps or even bouncing animations. keep it simple. it's annoying to see so much of going on only for booking cab. 
-outstation- i was not shown saved addresses. why? shown only in local ride.
-when im booking outstation in local, it should change tabs accordingly. i didn't know that user first has to make a choice. i was given some alert to navigate first to outstation to book respective ride. 
- user experience is really poor, seems like devs and designers are trying to make flashy app, but def not easy to use. can look upto uber app and learn from their mistakes.",,"lot of reloading maps, bouncing animations, keep it simple, annoying, not shown saved addresses, user experience poor, devs and designers, flashy app, not easy to use, ",,"app reliability, affordable",uber,,,FALSE,1,,,72,"bottomsheet,remain,intact,irrespective,changing,local,outstation,tabs,lot,reloading,maps,even,bouncing,animations,keep,simple,annoying,see,much,going,booking,cab,-outstation-,shown,saved,addresses,shown,local,ride,-when,im,booking,outstation,local,change,tabs,accordingly,not,know,user,first,make,choice,given,alert,navigate,first,outstation,book,respective,ride,user,experience,really,poor,seems,like,devs,designers,trying,make,flashy,app,def,easy,use,look,upto,uber,app,learn,mistakes"
RideHailing,empower-your-ride-your-way,Worst then Uber,1/1/2022 17:39,Austin Mook,"the price was good at the beginning, i'm going to the same place everyday for work then the price keep going up higher and higher it should stay the same went from $15 to $22 to $27 to $30 now i'm for 5 days straight",,"price keep going higher, ",,affordable,,1,,FALSE,1,,,21,"price,good,beginning,going,place,everyday,work,price,keep,going,higher,higher,stay,went,15,22,27,30,5,days,straight"
RideHailing,lyft,Disappointing,8/1/2022 18:00,Oshune18,"my ride took 35 minutes to arrive. when i chose the ride in the app, the app stated fastest. this was by far not the fastest. there were other lyfts that came to the airport a number of times before my lyft ever showed up. at this point i think i'm just going to switch to uber because i run into this problem too much.however, the driver was really nice and very friendly.",driver nice and friendly,"stated fastest, not the fastest, ",ride experience,app reliability,uber,1,,FALSE,2,,,33,"ride,took,35,minutes,arrive,chose,ride,app,app,stated,fastest,far,fastest,lyfts,came,airport,number,times,lyft,ever,showed,point,think,going,switch,uber,run,problem,much.however,driver,really,nice,friendly"
RideHailing,via-low-cost-ride-sharing,Lynn English,5/10/2022 9:34,Candee / Candis,"i had the pleasure of riding with margaret davis, wow what a very nice young lady, very friendly and very professional. after my no show 1st via driver did not show, which i was very upset waiting 45 to 50 minutes. but via credit my 2nd ride with margaret. thank you margaret & thank you viai am a regular rider alsothanks for turning my fown into a smile again..","friendly, professional, ","no show, driver did not show, upset waiting, ",ride experience,ride experience,,1,,FALSE,5,,,36,"pleasure,riding,margaret,davis,wow,nice,young,lady,friendly,professional,show,1st,via,driver,show,upset,waiting,45,50,minutes,via,credit,2nd,ride,margaret,thank,margaret,thank,viai,regular,rider,alsothanks,turning,fown,smile,.."
RideHailing,didi-rider-affordable-rides,Privacy policy not observed,9/30/2021 9:53,dgghjkkjcbjrcnn,a good app that was capable of ousting uber and bolt but their selfie requirement upon requesting is a nuisance. people are not comfortable with submitting their pictures frequently. they should not require people to take pics of themselves because it is boring besides time consuming.,,"selfie requirement, nuisance, not comfortable, submitting pictures frequently, boring, time consuming",,usable,"uber, bolt",1,,FALSE,1,,,24,"good,app,capable,ousting,uber,bolt,selfie,requirement,upon,requesting,nuisance,people,comfortable,submitting,pictures,frequently,require,people,take,pics,boring,besides,time,consuming"
RideHailing,lyft,Trash,3/26/2021 20:20,any name since all are take,"their is never any drivers an idea there is it take 4 of them to get to you in more then 30 mins , waste of storage on my phone i mean if there aren't any drivers why give me the option to request a ride . pointless",,"never any drivers, waste of storage in phone, pointless",,service availability,,1,,FALSE,1,,,19,"never,drivers,idea,take,4,get,30,mins,waste,storage,phone,mean,not,drivers,give,option,request,ride,pointless"
RideHailing,empower-your-ride-your-way,DONT RECOMMEND!,11/9/2021 22:25,cs12706,"if you cancel you will not get your refund, highly dont recommend!!!!.",,"cancel, not get refund",,payment reliability,,,,FALSE,1,,,6,"cancel,get,refund,highly,dont,recommend"
RideHailing,blablacar-carpooling-and-bus,"Nice idea, many glitches though",3/19/2022 21:10,RSB_83,"here is why this app is basically useless for me (yet, it's a general problem of blablacar as the website seems to have similar glitches): - you cannot change your location - you cannot change the language - you cannot change the currency. i mean, why?! someone either did not think at all, or spent way too much thinking on this app improving it to the worse i have a profile registered in germany. i am in mexico. the app assumes german time applied to mexico. thus, i cannot book a trip for today, because the app is telling me that a trip that is about to start in three hours has already begun. for example, it is 10 am mexican time, i found a ride for 1 pm mexican time, now the system internally adds 7 hours and assumes it is 5 pm mexican time. it doesn't display this time - and since this glitch is inconsistent - still shows all trips based on mexican time. hence, i see all trips but cannot book any that starts within the next seven hours. - yes, this is a bummer! :( particularly, since a driver didn't show up, and i desperately needed another trip asap. (by the way, i only figured out that this was the problem because the system added these seven hours to all the messages i sent to the driver. a message that i sent at 11:12 am was shown as sent at 6:12 pm) anyway, to find a way around this problem, i wanted to set up another profile with an appropriate time zone. yet, blablacar isn't available in the us so the .com domain is forwarded to their uk-website. setting up a profile in the uk, would have caused the same glitch however, i was able to setup another profile on their mexican website, but i struggled a lot because don't speak spanish and couldn't change the language. that, again, makes this app basically useless for me. however, now i saw the appropriate trips and with these many different mexican prices that were automatically changed to euro beforehand. yet, every driver in mexico wants to get paid in pesos. therefore, i would not be able to know how much a trip actually costs. these three issues - particularly in combination - are so ridiculous that i am wondering whether the people who have caused them actually get paid for their work. i mean, come on? something like that cannot even happen automatically, so i guess that this all is based on a few interns wanting to do a great job yet failing miserably i'd appreciate you'd sort these things out and make this app work for international travellers as well. thank you.",,"useless, glitches, cannot change location, cannot change currency, spent way too much thinking, cannot book trip, not display time, see trips but cannot book, bummer, driver not show up, ",,"usable, app reliability",,,,FALSE,1, location,1,234,"app,basically,useless,yet,general,problem,blablacar,website,seems,similar,glitches,change,location,change,language,change,currency,mean,someone,either,think,spent,way,much,thinking,app,improving,worse,profile,registered,germany,mexico,app,assumes,german,time,applied,mexico,thus,book,trip,today,app,telling,trip,start,three,hours,already,begun,example,10,mexican,time,found,ride,1,pm,mexican,time,system,internally,adds,7,hours,assumes,5,pm,mexican,time,not,display,time,since,glitch,inconsistent,still,shows,trips,based,mexican,time,hence,see,trips,book,starts,within,next,seven,hours,yes,bummer,particularly,since,driver,not,show,desperately,needed,another,trip,asap,way,figured,problem,system,added,seven,hours,messages,sent,driver,message,sent,11:12,shown,sent,6:12,pm,anyway,find,way,around,problem,wanted,set,another,profile,appropriate,time,zone,yet,blablacar,not,available,us,.com,domain,forwarded,uk-website,setting,profile,uk,would,caused,glitch,however,able,setup,another,profile,mexican,website,struggled,lot,not,speak,spanish,could,not,change,language,makes,app,basically,useless,however,saw,appropriate,trips,many,different,mexican,prices,automatically,changed,euro,beforehand,yet,every,driver,mexico,wants,get,paid,pesos,therefore,would,able,know,much,trip,actually,costs,three,issues,particularly,combination,ridiculous,wondering,whether,people,caused,actually,get,paid,work,mean,come,something,like,even,happen,automatically,guess,based,interns,wanting,great,job,yet,failing,miserably,appreciate,sort,things,make,app,work,international,travellers,well,thank"
RideHailing,didi-rider-affordable-rides,Garbic,7/19/2021 23:44,Creative-Think,it doesn't works plus they don't accept promo code that they provided.,,"not work, not accept promo",,usable,,,,FALSE,1,,,8,"not,works,plus,not,accept,promo,code,provided"
RideHailing,lyft,Jose,5/19/2021 13:54,Dr Kistler,my wallet fell out of my pocket. he found it and returned it. he was excellent!!!,"wallet fell out, returned",,ride experience,,,,,FALSE,5,,,6,"wallet,fell,pocket,found,returned,excellent"
RideHailing,uber-request-a-ride,No problemo Amigo!!,9/19/2021 1:10,rp4z5,"this is such a great app, i cannot for the life of me figure out why people depend on friends for a lift when they have this convience at hand anytime day or night weekend sporting event concert or just a friendly get together at your favorite restaurant tired of driving to work?no problem uber is there such a relief and with perks as well!","convienience at hand, friendly, no problem, ",,ride experience,,,,,FALSE,5,,,30,"great,app,life,figure,people,depend,friends,lift,convience,hand,anytime,day,night,weekend,sporting,event,concert,friendly,get,together,favorite,restaurant,tired,driving,work,problem,uber,relief,perks,well"
RideHailing,empower-your-ride-your-way,Terrible,8/8/2022 13:03,smd26309,takes very long to find driver then driver cancels rides when they close made me late for court this is terrible,,"takes long to find driver, cancel rides, close made late",,ride experience,,,,FALSE,1,,,12,"takes,long,find,driver,driver,cancels,rides,close,made,late,court,terrible"
RideHailing,lyft,Wait time inaccurate and will waste your time,11/17/2021 16:56,Turkpole,"used saver and it told me to wait 20 minutes, then told me to wait another 14 for information on my ride once the window expired. waste of time",,waste of time,,ride experience,,,,FALSE,2,,,16,"used,saver,told,wait,20,minutes,told,wait,another,14,information,ride,window,expired,waste,time"
RideHailing,uber-request-a-ride,Key features missing and bugs to report,10/11/2021 13:57,Dirkstar71,"it appears that there is no longer a family sharing option (feature)
i tried to request a ride for another rider (my daughter) and it appears that you can't schedule a pickup for another rider. (bug)
not integrated to apple pay so i have to manually type in credit card info (feature)
at this point would have expected the app to be more user friendly.",,"no longer family sharing option, not schedule pickup for another, not integrated apple pay, manually type, user friendly",,usable,,,,FALSE,2,,,35,"appears,longer,family,sharing,option,feature,tried,request,ride,another,rider,daughter,appears,ca,not,schedule,pickup,another,rider,bug,integrated,apple,pay,manually,type,credit,card,info,feature,point,would,expected,app,user,friendly"
RideHailing,didi-rider-affordable-rides,The app doesn't work with reward points,1/29/2021 17:26,ZZ0989898989,"you can use the app fine, but once you figure out how to apply the points to your ride, the taxi doesn't become available. this has happened multiple times. i apply the points and they won't come, but they come when no points are applied. also, even when points aren't applied, it's difficult to get service even with cars nearby.",,"apply points, taxi not available, ",,app reliability,,1,,FALSE,1,,,33,"use,app,fine,figure,apply,points,ride,taxi,not,become,available,happened,multiple,times,apply,points,wo,not,come,come,points,applied,also,even,points,not,applied,difficult,get,service,even,cars,nearby"
RideHailing,moovit-all-transit-options,Excellent App,12/15/2020 14:38,soupdragon12345,"as a very new bus driver , i needed something too help with route learning? and i found it with this app . i have recommended it too other new drivers also . 
i have nothing but positives too say about it , it will really help passengers and drivers get from point a to b .",,,,,,,,FALSE,5,,,24,"new,bus,driver,needed,something,help,route,learning,found,app,recommended,new,drivers,also,nothing,positives,say,really,help,passengers,drivers,get,point,b"
RideHailing,curb-the-taxi-app,Haven't been able to open the app in months.,7/16/2021 2:20,thank u bekah,app crashes immediately when tapped open. waste of time.,,"crashes, tapped open, waste of time",,app reliability,,,,FALSE,1,,,7,"app,crashes,immediately,tapped,open,waste,time"
RideHailing,didi-rider-affordable-rides,No response,6/19/2022 10:54,alhowa,"i was trying to register, i put my phone number many times but no message come .",,"trying to register, put phone number, no message come",,app reliability,,,,FALSE,1,,,9,"trying,register,put,phone,number,many,times,message,come"
RideHailing,lyft,Not Enough Drivers Available,4/8/2021 1:29,PopcornSpecialist,"there has been numerous times i requested a ride and had to wait 1-2 hours just for the system to kick the ride request out forcing me to start a new ride request, and then i never end up getting a ride and have to walk to my destination.",,"numerous times, requested ride, wait hours, system kick the ride request, forcing to start new ride request, never end up getting ride",,app reliability,,1,,FALSE,3,,,22,"numerous,times,requested,ride,wait,1-2,hours,system,kick,ride,request,forcing,start,new,ride,request,never,end,getting,ride,walk,destination"
RideHailing,beat-ride-app,Worse service ever,6/24/2021 1:59,erikamarcano,don't waste your time!!! if you are using this app in mexico city is a pain in the .. they don't have a clear contact info to find answer. allllll bad!!,,"using app, pain, not clear contact info",,usable,,,,FALSE,1,contact info,1,17,"not,waste,time,using,app,mexico,city,pain,..,not,clear,contact,info,find,answer,allllll,bad"
RideHailing,uber-request-a-ride,Stole money from me,4/18/2022 1:01,billskankdick,"ordered food, says the delivery was failed. did not get refunded and can't get in touch with support. just use door dash or grub hub for food lol.",,"ordered food, delivery failed, not get refunded, not get in touch with support, ",,"ride experience, payment reliability, customer service","door dash, grub hub",,,FALSE,1,,,19,"ordered,food,says,delivery,failed,get,refunded,ca,not,get,touch,support,use,door,dash,grub,hub,food,lol"
RideHailing,lyft,System and Customer service issues,12/20/2021 19:32,Aar510,"lyft makes it impossible to contact them regarding issues especially when it comes to drivers cancelling rides, starting rides without being picked up, or drivers marking that they have arrived and are not actually at your location. this is my second issue in a week and i am absolutely done with using this ride app. i used to only use lyft and now i am switching to uber.",,"imppossible to contact regarding issues, drivers cancelling rides, starting rides without picked up, ",,"customer service, ride experience",uber,,,FALSE,1, location,1,33,"lyft,makes,impossible,contact,regarding,issues,especially,comes,drivers,cancelling,rides,starting,rides,without,picked,drivers,marking,arrived,actually,location,second,issue,week,absolutely,done,using,ride,app,used,use,lyft,switching,uber"
RideHailing,empower-your-ride-your-way,Fantastic app!,4/17/2021 15:24,ztztkb,"simple design, great features and even better prices.","simple design, great features, better prices",,"usable, affordable",,,,,FALSE,5,,,7,"simple,design,great,features,even,better,prices"
RideHailing,uber-request-a-ride,Trash company with woke views,10/11/2021 12:33,bestpk3r1234,"they'll spend billions and millions on lecturing people on coming out but can't run a basic ride share app. 

garbage company with even worse leftist dogma views.",,cant run basic ride,,,,,,FALSE,1,,,20,"spend,billions,millions,lecturing,people,coming,ca,not,run,basic,ride,share,app,garbage,company,even,worse,leftist,dogma,views"
RideHailing,grab-superapp,So expEnsive,1/21/2021 9:39,richi ki,"this is non sense! i was about to order food from kfc which is infront of my house and the delivery tax is 2500mmk for 3100 mmk this is so expensive! i would rather walk and buy my own instead. and the others, i was about to order 1500 mmmk chips and the delivery fee is 2500mmk, look, the delivery is more expensive than the food .",,"nonsense, expensive, ",,affordable,,,,FALSE,1,,,30,"non,sense,order,food,kfc,infront,house,delivery,tax,2500mmk,3100,mmk,expensive,would,rather,walk,buy,instead,others,order,1500,mmmk,chips,delivery,fee,2500mmk,look,delivery,expensive,food"
RideHailing,lyft,Best driver EVER,12/30/2020 17:08,arabellascharms,"i am not exaggerating. i could not have been in a limousine and been treated any better. this very polite and respectful, hospitable young man someone somewhere could invest and get a limo for him!   he has serious potential at anything","polite, respectful, hospitable, serious potential",,ride experience,,,,,FALSE,4,,,19,"exaggerating,could,limousine,treated,better,polite,respectful,hospitable,young,man,someone,somewhere,could,invest,get,limo,serious,potential,anything"
RideHailing,lyft,Daily ride,4/4/2022 9:57,@Lear2208,"this's is the top one to take an affordable ride to work, travel safe and convenient, especially with the economic activity of our business. also, compare to others app, this one send you cars in (great) conditions and amazing atmosphere while you on your way to your destination. i highly recommend this app.","affordable ride, travel safe, convenient, cars in great condition, atmosphere",,"ride experience, affordable",,,,,FALSE,5,,,29,"top,one,take,affordable,ride,work,travel,safe,convenient,especially,economic,activity,business,also,compare,others,app,one,send,cars,great,conditions,amazing,atmosphere,way,destination,highly,recommend,app"
RideHailing,lyft,Weak,3/26/2021 2:43,hehehaha28,aren't very fast as getting rides to people booking for a certain time. drivers are to out of distance takes to long for them to get to you,,"not very fast getting rides, drivers out of distance, takes too long to get you",,ride experience,,,,FALSE,3,,,13,"not,fast,getting,rides,people,booking,certain,time,drivers,distance,takes,long,get"
RideHailing,bolt-fast-affordable-rides,Fun and quick,9/14/2021 8:13,Outcomefocusedengineer,"a bolt scooter fully charged lasted me about 1 hr and 20min of constant driving.  i went from linninhall out past the soviet memorial (maarjamae) back along the coast to rotterdam city, up and around tompea, then around the rest of old town and back to line hall.  a couple of good hills on which the scooter struggled (i'm over 300 lbs) and a whole lot of sightseeing and bike lanes.  i appreciate the max rate of $15/day, but wish it were easier to get the $10 day pass.",,,,,,,,FALSE,5,,,52,"bolt,scooter,fully,charged,lasted,1,hr,20min,constant,driving,went,linninhall,past,soviet,memorial,maarjamae,back,along,coast,rotterdam,city,around,tompea,around,rest,old,town,back,line,hall,couple,good,hills,scooter,struggled,300,lbs,whole,lot,sightseeing,bike,lanes,appreciate,max,rate,15/day,wish,easier,get,10,day,pass"
RideHailing,uber-request-a-ride,Hurts more than it helps,5/5/2022 21:54,apocafist,"my drivers are always far, only got a close driver twice. it tried to take me around camp creek to get to my house had to tell the driver where to go. i had booked an uber about 2 weeks ago and the driver couldn't make it to me because a train was blocking the road",,"drivers always far, ",,service availability,,,,FALSE,2,,,29,"drivers,always,far,got,close,driver,twice,tried,take,around,camp,creek,get,house,tell,driver,go,booked,uber,2,weeks,ago,driver,could,not,make,train,blocking,road"
RideHailing,lyft,San Fran,3/10/2022 23:26,wqtyffff,the driver was good however some of the addresses are not labeled and pick up is up to one block away city is not very friendly addresses,,"addresses not labeled, pickup not friendly addresses",,"personal safety, app reliability",,,,FALSE,5,,,12,"driver,good,however,addresses,labeled,pick,one,block,away,city,friendly,addresses"
