RideHailing,waze-carpool,Internet,6/7/2022 23:31,unbndbeing,it won't let me log in it says i have no internet. i have full bars and wi-fi is on!!!!,,"not let, login, no internet, full bars, wifi on",,app reliability,,,,FALSE,1,,,9,"wo,not,let,log,says,internet,full,bars,wi-fi"
RideHailing,revel-all-electric-rides,BEST THING EVER INVENTED,8/18/2021 21:08,A must have for a to do list.,so much fun riding around dc in this bike. loved it and super efficient.,efficient,,ride experience,,,,,FALSE,5,,,9,"much,fun,riding,around,dc,bike,loved,super,efficient"
RideHailing,gett-business-ground-travel,Outstanding app and service,11/21/2021 13:17,mikee219,nothing to add. use it!!!,,,,,,,,FALSE,5,,,3,"nothing,add,use"
RideHailing,lyft,HORRIBLE,6/11/2021 19:19,Jeanettec1285,this app is horrible drivers keeps canceling and the app keeps looking for drivers and will have you waiting for almost an hour just finally get a driver to cancel two minutes away. worst service ever,,"keeps canceling, keep looking for drivers, waiting for an hour, get driver to cancel, worse service",,ride experience,,,,FALSE,1,,,22,"app,horrible,drivers,keeps,canceling,app,keeps,looking,drivers,waiting,almost,hour,finally,get,driver,cancel,two,minutes,away,worst,service,ever"
RideHailing,rapido-indias-bike-taxi,Frustrating,4/7/2022 4:11,Worst rapido,i waited for 20minutes and last moment they canceled the bike and also the worst is the driver  ask for location and when i gave the location he canceled . worst service ever,,"waited, canceled, ask for location, canceled",,ride experience,,,,FALSE,1, location,1,17,"waited,20minutes,last,moment,canceled,bike,also,worst,driver,ask,location,gave,location,canceled,worst,service,ever"
RideHailing,lyft,Sonya,4/20/2022 15:32,hhjsue,a lovely lady!  nice conversation on the way to the airport! thank you sonya!!,"nice conversation, ",,ride experience,,,,,FALSE,5,,,8,"lovely,lady,nice,conversation,way,airport,thank,sonya"
RideHailing,flywheel,Flywheel support,7/12/2021 19:50,jutherhub,their phone number on the website 1-855-359-2420 doesn't even work. i submitted a help issue on the app and didn't receive any kind of acknowledgement. i was falsely charged for a ride i didn't take. hopefully i'll hear back soon or report it as fraudulent charge.,,"phone number on website, not work, submitted help issue, not receive acknowledgement, falsely charged, fraudulent charge",,"fraud, payment reliability, customer service",,,,FALSE,1,,,27,"phone,number,website,1-855-359-2420,not,even,work,submitted,help,issue,app,not,receive,kind,acknowledgement,falsely,charged,ride,not,take,hopefully,hear,back,soon,report,fraudulent,charge"
RideHailing,hopskipdrive,Driver problem,12/8/2021 23:29,ASmith2744,"when the service works, it's great. a little pricey, but it'll get you out of a jam. the problem i had is that there just weren't enough drivers. i tried to use the service 10 times over 3 weeks, and it only matched a driver twice. and this was scheduling the pickup days in advance.",,"little pricey, not enough drivers, ",,"affordable, service availability",,,,FALSE,2,,,25,"service,works,great,little,pricey,get,jam,problem,not,enough,drivers,tried,use,service,10,times,3,weeks,matched,driver,twice,scheduling,pickup,days,advance"
RideHailing,lyft,Unreliable,5/29/2022 15:05,19kategarner,"their wait and save feature is a joke. we waited hours for a ride, then after cancelling and booking a regular ride our driver told us to get out because our destination was too far.",,"wait and save feature, joke, waited hours, canceling and booking, regular ride, driver told to get out",,ride experience,,,,FALSE,1,,,17,"wait,save,feature,joke,waited,hours,ride,cancelling,booking,regular,ride,driver,told,us,get,destination,far"
RideHailing,ztrip,Horrible,4/10/2021 7:55,none of your business 02,drivers are unprofessional they cancel at the last minute they are rude and late i don't understand how this company is still up and running,,"unprofessional, cancel at last minute, rude, late",,ride experience,,,,FALSE,1,,,12,"drivers,unprofessional,cancel,last,minute,rude,late,not,understand,company,still,running"
RideHailing,lyft,Fix your GPS,6/27/2021 0:36,KrylonPDX,your gps is buggy. it's a frustration i've shared with friends and drivers.,,"buggy, frustration,",,app reliability,,,,FALSE,4,,,6,"gps,buggy,frustration,shared,friends,drivers"
RideHailing,hopskipdrive,Huge disappointment,3/8/2022 23:49,FizNizzle,"the idea of transporting kids is fabulous.  however, everything else does not live up to what is advertised. 

we had scheduled a ride for our daughter to be picked up from school and even though she was waiting in the designated area, the driver was not able to get into the parking lot on time and we were charged a $10 late fee because of it.

 most recently we had booked a ride for 4 o'clock and were told the driver would be there 20 minutes late, no compensation, and our daughter had to find another ride, yet we were still charged the full price of the ride. i would not recommend this app to anybody who is looking for reliable, and helpful transportation for their children if they are not able to do it for themselves. 

the worst part of this app is the customer service no return emails, no return calls, and certainly no refunds.  buyer be very aware!",,"waiting in designated area, driver not able to get into parking, charged for late fee, no compensation, still charged full price, customer service, no return emails, no return calls, no refunds",,"ride experience, payment reliability, customer service",,,,FALSE,1,,,74,"idea,transporting,kids,fabulous,however,everything,else,live,advertised,scheduled,ride,daughter,picked,school,even,though,waiting,designated,area,driver,able,get,parking,lot,time,charged,10,late,fee,recently,booked,ride,4,o,told,driver,would,20,minutes,late,compensation,daughter,find,another,ride,yet,still,charged,full,price,ride,would,recommend,app,anybody,looking,reliable,helpful,transportation,children,able,worst,part,app,customer,service,return,emails,return,calls,certainly,refunds,buyer,aware"
RideHailing,blue-bird-group-taxi-mobile,SMS Verification didn't work so app wouldn't let me use it,3/30/2022 4:26,TheNeonKnights,very lame that a verification code they didn't send is why i can't use the app,,"lame, verification code, not send",,app reliability,,,,FALSE,1,,,9,"lame,verification,code,not,send,ca,not,use,app"
RideHailing,lyft,Weed Out,1/2/2022 10:47,Big Money E,"i love the fact if you give a driver less then a perfect review, he/she will not be dispatched to you ever again!  this is useful in a small community.",,,,,,,,FALSE,5,,,13,"love,fact,give,driver,less,perfect,review,he/she,dispatched,ever,useful,small,community"
RideHailing,hopskipdrive,Wonderful Service,3/5/2022 23:42,JG1337V,hopskipdrive has the best drivers around. a true life-saver!,,,,,,,,FALSE,5,,,6,"hopskipdrive,best,drivers,around,true,life-saver"
RideHailing,rapido-indias-bike-taxi,Really bad service,4/21/2022 5:22,rid2804,they will sometimes charge you double of the ride estimate and you can't do anything about it. always take a screenshot of the estimate so that they can't cheat you later,,,,,,,,FALSE,1,,,16,"sometimes,charge,double,ride,estimate,ca,not,anything,always,take,screenshot,estimate,ca,not,cheat,later"
RideHailing,lyft,Credit card,12/1/2021 0:10,Maribel61,i stooped using your services because lift used my cc i hope that this time you protect my cc,,,,data privacy,,,,FALSE,5,,,10,"stooped,using,services,lift,used,cc,hope,time,protect,cc"
RideHailing,uber-request-a-ride,Uber Eats Notifications,4/3/2021 16:58,Idonotwantubereats,"uber is okay, i have it on my phone but i have never used uber eats nor have that app downloaded on my phone and uber sends me a notification every few days about uber eats. it's been months and i'm finally so fed up about this stupid alert about a service i have absolutely no use for that i searched within the app how to edit the notifications. could not find out a way so i just deleted this app as a permanent solution. annoying and unnecessary for it to be going off that much.",,"stupid alert, service no use, not find out a way, annoying, unnecessary",,usable,,,,FALSE,2,,,41,"uber,okay,phone,never,used,uber,eats,app,downloaded,phone,uber,sends,notification,every,days,uber,eats,months,finally,fed,stupid,alert,service,absolutely,use,searched,within,app,edit,notifications,could,find,way,deleted,app,permanent,solution,annoying,unnecessary,going,much"
RideHailing,via-low-cost-ride-sharing,Good Reviews has got to be FAKE,8/6/2021 20:21,keylamarie99,"this app is beyond disappointing i dont even come on the app store to write reviews ever ! and this app got me so mad i'm really here writting this ! 
literally tried to order a cab about 3 hours ago! literally one cancels after another mind you i was waiting the 18mins they gave then jumped to 25! then to 20 then cancel this is crazy .",,"order cab, hours ago, cancels",,app reliability,,,,FALSE,1,,,36,"app,beyond,disappointing,dont,even,come,app,store,write,reviews,ever,app,got,mad,really,writting,literally,tried,order,cab,3,hours,ago,literally,one,cancels,another,mind,waiting,18mins,gave,jumped,25,20,cancel,crazy"
RideHailing,lyft,Spencer,4/10/2022 18:04,"HT, fan of Spencer.",spencer was so nice and thoughtful. his car was clean an smelled wonderful. he is a fantastic lyft employee & a i hope he gets recognized for his  curtesy and respect  to his  rides.,"nice, thoughtful, clean, curtesy, respect",,ride experience,,,,,FALSE,5,,,16,"spencer,nice,thoughtful,car,clean,smelled,wonderful,fantastic,lyft,employee,hope,gets,recognized,curtesy,respect,rides"
RideHailing,lyft,Not letting me get a Lyft unless I add my ID,7/15/2022 8:20,KiraTanayaaa,i love the app but i literally just hate when my lyft make me show my id to see my id,,,,,,,,FALSE,5,,,10,"love,app,literally,hate,lyft,make,show,id,see,id"
RideHailing,moovit-all-transit-options,Great app,7/23/2022 14:33,rtonesss,i use this all the time to find my around the city and get to any location. easy to use and accurate.,"easy to use, accurate",,"usable, app reliability",,,,,FALSE,5, location,1,10,"use,time,find,around,city,get,location,easy,use,accurate"
RideHailing,lyft,TERRIBLE DO NOT USE,1/9/2021 22:10,Vinareiss,if i had a vehicle i would never use lyft. i've had multiple issues with lyft cancelling my rides after assigning me a driver.,,"mulitple issues, canceling rides, assigning driver",app reliability,,,1,,FALSE,2,,,12,"vehicle,would,never,use,lyft,multiple,issues,lyft,cancelling,rides,assigning,driver"
RideHailing,uber-request-a-ride,Can't use a voucher or enter payment,4/23/2022 0:46,Hi khoa,"i'm sitting at an airport and have downloaded the voucher i was given and the stupid app will not let me request a ride even though i am trying to use the voucher which is fully paid for by the company. when i try to enter a payment method to see if that will work, i get a blank screen. terrible experience.",,"not let request, use voucher, fully paid, enter payment method, blank screen","usable, ",,,,,FALSE,1,,,29,"sitting,airport,downloaded,voucher,given,stupid,app,let,request,ride,even,though,trying,use,voucher,fully,paid,company,try,enter,payment,method,see,work,get,blank,screen,terrible,experience"
RideHailing,uber-request-a-ride,Lied on by driver,11/4/2021 19:11,juanelle green,"i was recently reported for not having on a mask when i have never entered an uber with out my mask ,was trying to get customer service and nothing this is unfair to me to be lied on when i am spending my money and i dnt think i need to use uber anymore i made sure i had on my mask and he has a camera ,where it can be watched ,very disappointed..",,"customer service, unfair to be lied, ",,customer service,,,,FALSE,2,,,29,"recently,reported,mask,never,entered,uber,mask,trying,get,customer,service,nothing,unfair,lied,spending,money,dnt,think,need,use,uber,anymore,made,sure,mask,camera,watched,disappointed,.."
RideHailing,uber-request-a-ride,GREAT UBER DRIVER!,5/5/2021 3:01,Nana in California,it was our first experience with ordering a uber ride....... and it went really smoothly. easy app and easily ordering a ride. our driver was right on time. we will for sure be doing  it again !,"easy app, easily ordering, right on time",,"usable, ride experience",,,,,FALSE,5,,,18,"first,experience,ordering,uber,ride,.......,went,really,smoothly,easy,app,easily,ordering,ride,driver,right,time,sure"
RideHailing,lyft,Lyft driver scammed me out of $80,10/26/2021 13:44,KayyGD,"i was a lyft supporter until my recent situation. i am a college student so i use lyft multiple times a week to get around. however, i was recently charged a damage fee when i had done nothing. i had no idea drivers were able to just add charges without any evidence. lyft has no customer service number therefore, i was unable to call and speak to someone about this issue. it is not okay that delivery drivers can make claims without going through some type of process. so beware, if a lyft drivers wants to charge you a $80 damage fee for no reason they can.",,"charged damage fee, done nothing, add charges without evidence, no customer service number, unable to call and speak, make claims without going through process, ",,"payment reliability, customer service",,,,FALSE,1,,,55,"lyft,supporter,recent,situation,college,student,use,lyft,multiple,times,week,get,around,however,recently,charged,damage,fee,done,nothing,idea,drivers,able,add,charges,without,evidence,lyft,customer,service,number,therefore,unable,call,speak,someone,issue,okay,delivery,drivers,make,claims,without,going,type,process,beware,lyft,drivers,wants,charge,80,damage,fee,reason"
RideHailing,lyft,Fare,6/19/2021 4:33,beanMCHP,fare need to be affordable enough their to high & when in poverty right now,,,,affordable,,,,FALSE,2,,,7,"fare,need,affordable,enough,high,poverty,right"
RideHailing,moovit-all-transit-options,awesome app!!,6/9/2022 2:17,eh tee wah,"this app is so easy to use and very helpful, it also doesn't need wifi to use it so that's an extra plus!!","easy to use, helpful, not need wifi",,usable,,,,,FALSE,5,,,11,"app,easy,use,helpful,also,not,need,wifi,use,extra,plus"
RideHailing,ola-cabs,Vulgarity over calls,8/2/2021 9:57,Jahanvee,"i had a very important exam 
i booked a cab around 6am 
initially the driver cancelled the trip 

when a new person accepted the ride.he kept calling me for drop and pickup location even after clearly mentioning it on the app as well as on the phone call and wasted a lot of time.

if this was not enough he called again and start making vulgar sounds on phone which was extremely uncomfortable and disrespectful, and immediately after this he cancelled the trip.
i need a strict legal action against this specific driver 

i tried to book another cab the drivers kept accepting the request, waste time over call and  then cancelling them. 

what sort of behaviour is this? i expect a legitimate answer to this.

i don't know for sure what services is the app actually providing to the people.",,"cancelled trip, calling for drop and pickup location, wasted a lot of time, vulgar sounds, uncomfortable, disrespectful, legal action, ",,ride experience,,,,FALSE,1, location,1,73,"important,exam,booked,cab,around,6am,initially,driver,cancelled,trip,new,person,accepted,ride.he,kept,calling,drop,pickup,location,even,clearly,mentioning,app,well,phone,call,wasted,lot,time,enough,called,start,making,vulgar,sounds,phone,extremely,uncomfortable,disrespectful,immediately,cancelled,trip,need,strict,legal,action,specific,driver,tried,book,another,cab,drivers,kept,accepting,request,waste,time,call,cancelling,sort,behaviour,expect,legitimate,answer,not,know,sure,services,app,actually,providing,people"
RideHailing,lyft,Cancel,12/6/2021 18:50,go cuddle hdudber,not easy to cancel the service.,,"not easy, cancel ride",,usable,,,,FALSE,1,,,3,"easy,cancel,service"
RideHailing,lyft,$150 Damage charge?,7/1/2021 11:46,kmeed,after all my experiences with being late due to a lyft driver or even the fare going up from $7 to 9-15 i kept riding with lyft and didn't complain. now i've been accused of leaving damage during my 5 minute ride home from work. specifically cigarette burn damage and i dont even smoke!! i work in childcare so after a long day the last thing i expected was a $150 damage charge for damage i didn't do.,,"accused of leaving damange, cigarette burn damange, not even smoke, ",,ride experience,,,,FALSE,1,,,42,"experiences,late,due,lyft,driver,even,fare,going,7,9-15,kept,riding,lyft,not,complain,accused,leaving,damage,5,minute,ride,home,work,specifically,cigarette,burn,damage,dont,even,smoke,work,childcare,long,day,last,thing,expected,150,damage,charge,damage,not"
RideHailing,lyft,BWI to Annapolis Courtyard-8/31,9/1/2021 2:34,JTNT65,"excellent service by eli; nice, clean, safe, large car; good, safe, driver with peasant & helpful attitude   
great ride!!!",,,ride experience,,,,,FALSE,5,,,16,"excellent,service,eli,nice,clean,safe,large,car,good,safe,driver,peasant,helpful,attitude,great,ride"
RideHailing,beat-ride-app,Gets worse and worse,9/20/2021 10:20,Harossi,"this app used to be great but keeps getting worse and worse! 
1) waiting times (if you are lucky to find a cab available) have been going up and up and i talking about suburbs around the center of athens. 
2) cab drivers can cancel the ride even though they were on their way to you, without any explanation and beat doesn't give you the option to leave negative feedback on them.",,"waiting times, cancel ride without explanation, not option to leave negative feedback",,ride experience,,,,FALSE,2,,,37,"app,used,great,keeps,getting,worse,worse,1,waiting,times,lucky,find,cab,available,going,talking,suburbs,around,center,athens,2,cab,drivers,cancel,ride,even,though,way,without,explanation,beat,not,give,option,leave,negative,feedback"
RideHailing,lyft,Slight glitch in the system,6/4/2022 3:24,AGracious1,"i've been using lyft for the past 2 days while my car is being serviced. i had ordered a lyft this evening and unfortunately misplaced my phone for 10 minutes or so. when i found it, the app said the driver was there. i couldn't find him, nor was he answering his phone or messages. i ended being charged full price and i am, needless to say, not too happy about the fraudulent charge. i get a fee for missing the ride, but being charged full price for a service that didn't occur is illegal. supposedly i will receive a refund in 5-7 days.  the driver, however, tried to pretend he drove me there when my gps clearly noted i wasn't in his car. i'm not very happy about the pending charge and think that lyft needs to have customer service reps ready to talk, instead of messaging.",,"charged full price, fraudulent charge, fee for missing ride, illegal, customer service",,"payment reliability, customer service",,,,FALSE,2,,,73,"using,lyft,past,2,days,car,serviced,ordered,lyft,evening,unfortunately,misplaced,phone,10,minutes,found,app,said,driver,could,not,find,answering,phone,messages,ended,charged,full,price,needless,say,happy,fraudulent,charge,get,fee,missing,ride,charged,full,price,service,not,occur,illegal,supposedly,receive,refund,5-7,days,driver,however,tried,pretend,drove,gps,clearly,noted,not,car,happy,pending,charge,think,lyft,needs,customer,service,reps,ready,talk,instead,messaging"
RideHailing,lyft,Thanks,10/6/2021 18:03,Felixuchekam,quick response! thanks,,,,,,,,FALSE,5,,,3,"quick,response,thanks"
RideHailing,uber-request-a-ride,"Always have issue with this app, use Lyft",11/29/2021 4:18,stonemco,"i always have issues, the new update won't let me schedule a time in advance, what's the point of this stupid app if it doesn't do what you promise. be smart and go with lyft, always works.",,"issues, update, not let schedule, ",,usable,lyft,,,FALSE,1,,,20,"always,issues,new,update,wo,not,let,schedule,time,advance,point,stupid,app,not,promise,smart,go,lyft,always,works"
RideHailing,lyft,Canceled Ride,7/5/2021 5:32,catlinm,purchased wait and save option the driver canceled at last minute and was pushed out to main menu! do not use!!!! terrible app and service!!!!,,"purchased, wait and save option, canceled, pushed out, ",,ride experience,,,,FALSE,1,,,15,"purchased,wait,save,option,driver,canceled,last,minute,pushed,main,menu,use,terrible,app,service"
RideHailing,scoop-carpool-w-co-workers,Great app but buggy,8/9/2022 5:03,www.saval.in,"the app doesn't let me view the rider details. need to track the rider through sms when they message, assuming they are able to see the driver - frustrating experience.",,"not let view, need to track, frustrating ",,usable,,,,FALSE,2,,,17,"app,not,let,view,rider,details,need,track,rider,sms,message,assuming,able,see,driver,frustrating,experience"
RideHailing,cabify,Terrible dysfunctional app,7/24/2021 18:39,AirN0mad,"from the beginning this app has been incredibly difficult to use. for many weeks i was not able to create an account, and customer service was of no use. a long time later when i finally managed to make one, the app was full of issues, i was not able to order any cars. it's so glitchy. with the most recent journey, on the app the journey never changed status to complete, there was nothing i could do about it, no customer service number to call, and so i was not able to use the app to order any other cars because it was showing that i was currently on a journey. then the app logs me out and i haven't been able to log back in, once again customer service is of no use. i'm still not logged in, still can't use it. also, they gave me discount codes which turned out to be unusable, customer service saying the code was meant for one specific city far away - when i originally received the code, there was 0 mention of it being for a specific city. skip this app, any other rideshare company will be better than cabify.",,"difficult to use, not able to create, customer service no use, full of issues, discount codes, unusable, glitchy, ",,"usable, customer service, app reliability",,,,FALSE,1,,,93,"beginning,app,incredibly,difficult,use,many,weeks,able,create,account,customer,service,use,long,time,later,finally,managed,make,one,app,full,issues,able,order,cars,glitchy,recent,journey,app,journey,never,changed,status,complete,nothing,could,customer,service,number,call,able,use,app,order,cars,showing,currently,journey,app,logs,not,able,log,back,customer,service,use,still,logged,still,ca,not,use,also,gave,discount,codes,turned,unusable,customer,service,saying,code,meant,one,specific,city,far,away,originally,received,code,0,mention,specific,city,skip,app,rideshare,company,better,cabify"
RideHailing,revel-all-electric-rides,Use my code to get off waitlist (4lljo6),1/15/2022 1:02,BrooklynG,use my code for instant access to ride share and $10 free ride credit (4lljo6) ,,,,,,,,FALSE,5,,,11,"use,code,instant,access,ride,share,10,free,ride,credit,4lljo6"
RideHailing,lyft,Late,12/16/2020 11:52,dumbasslyft,im getting so tired of lyft they hire almost anyone. i set a scheduled ride for 6:40am i have to be at work at 7am i live right around the corner from my job and now i am going to be late to work.,,,,ride experience,,,,FALSE,1,,,21,"im,getting,tired,lyft,hire,almost,anyone,set,scheduled,ride,6:40am,work,7am,live,right,around,corner,job,going,late,work"
RideHailing,grab-superapp,Some bugs,7/19/2021 16:29,Phoebe_214,"when trying to select date of ticket for an attraction, the whole thing freezes.",,,,app reliability,,,,FALSE,2,,,8,"trying,select,date,ticket,attraction,whole,thing,freezes"
RideHailing,rapido-indias-bike-taxi,No way to connect to customer care,10/8/2021 5:11,ran2986,"there is no way to connect customer care,which is required frequently",,"no way to connect, customer care",,customer service,,,,FALSE,1,,,6,"way,connect,customer,care,required,frequently"
RideHailing,grab-superapp,Airport Drivers who use grab,12/12/2021 9:12,allthenicknamearetakenFU,"grab doesn't take any action to the drivers who don't cancel the order even they said they won't come. today, i found three drivers.they were in same spots and they said they won't come and i asked them to ask the order but they didn't do. wasted time",,"wasted time, ",,ride experience,,1,,FALSE,1,,,28,"grab,not,take,action,drivers,not,cancel,order,even,said,wo,not,come,today,found,three,drivers.they,spots,said,wo,not,come,asked,ask,order,not,wasted,time"
RideHailing,lyft,Taylor,6/30/2022 4:07,kodi mcc,taylor was very nice and was a great driver felt very comfortable,comfortable,,ride experience,,,,,FALSE,5,,,6,"taylor,nice,great,driver,felt,comfortable"
RideHailing,hopskipdrive,Garbage app,8/23/2022 23:58,Mommasan89,this app is terrible. i just downloaded it based on a friend's recommendation and am trying to add a trip for friday morning for school. can't progress past the screen regarding location notes. it just spins and doesn't save anything.,,"cant progress, past the screen, not save",,usable,,,,FALSE,1, location,1,24,"app,terrible,downloaded,based,friend,recommendation,trying,add,trip,friday,morning,school,ca,not,progress,past,screen,regarding,location,notes,spins,not,save,anything"
