RideHailing,uber-request-a-ride,It's shame!,3/7/2022 12:45,kpallin13,"lately i have used the lyft app more than uber, not only because it has better prices but their customer service is better too, they do not charge the extra time and waiting time and add it to is already supposed to it is a fixed charge.  in addition to all these problems, what about prices?  they go up and down as they please.  i live in miami and a ride where i pay between $13 and $15 every day increases to $44 and $55.  does that seem fair?  they should do something about their prices.  is more than double!  you guys are stealing from us!!","prices go up and down as pleased, more than double, stealing",,affordable,,lyft,,,FALSE,1,,,44,"lately,used,lyft,app,uber,better,prices,customer,service,better,charge,extra,time,waiting,time,add,already,supposed,fixed,charge,addition,problems,prices,go,please,live,miami,ride,pay,13,15,every,day,increases,44,55,seem,fair,something,prices,double,guys,stealing,us"
RideHailing,lyft,Love the Lyft!,5/14/2021 19:52,D.J.48,i've been using it as a family to get to work it's very easy to use the app. good fair rides to work! thanks,"easy to use, fair rides",,usable,,,,,FALSE,5,,,12,"using,family,get,work,easy,use,app,good,fair,rides,work,thanks"
RideHailing,wingz,Ride share with car seats amazing,7/30/2021 19:16,Mrr Willlliam,just completed a trip and we needed two car seats and wingz came through without any issues driver frank was on time in a new van with two car seats installed and ready to go,"came through without issues, on time, ready to go",,ride experience,,,,,FALSE,5,,,21,"completed,trip,needed,two,car,seats,wingz,came,without,issues,driver,frank,time,new,van,two,car,seats,installed,ready,go"
RideHailing,scoop-carpool-w-co-workers,Bug - can not open the latest booking,4/5/2022 23:42,2.18.1.14662-appstore,latest booking opens after several clicks. had me missing the booking deadline.,,"booking opens, several clicks, missing, booking deadline",,app reliability,,,,FALSE,1,,,8,"latest,booking,opens,several,clicks,missing,booking,deadline"
RideHailing,cabify,"App OK, service really bad",5/19/2022 18:13,atezanos,"service in madrid is just getting worse and worse, don't use it, it's extremely expensive for the bad quality",,"service getting, worse and worse, extremely expensive, bad quality",,"affordable, ride experience",,,,FALSE,1,,,11,"service,madrid,getting,worse,worse,not,use,extremely,expensive,bad,quality"
RideHailing,lyft,Receipts a challenge,8/9/2021 10:53,archicamp,"i use lyft often but need to get receipts for submitting to work. if i don't add a tip before they send me a receipt, i can't seem to get one receipt showing the tip and fare. 
it's been a challenge with my reimbursements",,"need to get receipts, not add tip, before send receipt, cant' get receipt with tip and fare, challenge with reimbursement",,,,,,FALSE,3,,,24,"use,lyft,often,need,get,receipts,submitting,work,not,add,tip,send,receipt,ca,not,seem,get,one,receipt,showing,tip,fare,challenge,reimbursements"
RideHailing,cabify,Not worth it,7/18/2021 18:07,7.49E+12,can't even get a ride without it saying there's a connection issue. all my other apps work just fine.,,"not get ride,  connection issue, other apps, work fine",,app reliability,,,,FALSE,1,,,12,"ca,not,even,get,ride,without,saying,connection,issue,apps,work,fine"
RideHailing,uber-request-a-ride,"Oh, *now* it will actually cost this much",7/20/2021 3:54,ThatOtherGuy75,"i haven't used uber in a while, and now i don't think i will again.

i used to use uber a lot for business trips, it worked, nothing fancy or special, but it got the job done and that's what i needed. so i'd say 4 stars back 6-7 years ago.

however this past weekend was horrible. for the second time on the same trip the prices fluctuated wildly. i booked a trip to get to the airport, $45. not great but not horrible. i had to restart the app, and then the trip $65. annoying,  but i lucked out and a friend was able to come through and give me a ride at 4:30am. i got to the airport, flew out of state, flew back and needed a ride due to unfortunate unforeseen circumstances. the trip was supposed to be $60, and then a minute later when i tried to submit the pickup destination the app transitioned back to the main screen, and now the price was $100. i tried again because i wanted to get home after seeing my grandmother dying, but it reverted to the main screen again and now the prices were $120. this was all for the cheapest option too. so i downloaded the lyft app, and paid $50 to get home, using the car ride to craft this review.

i'm not just going to vote with stars, but with my money. i'll choose lyft every time now over uber.",g,"same trip, prices fluctuated wildly, restart app, annoying",,"affordable, app reliability",lyft,,,FALSE,2,,,118,"not,used,uber,not,think,used,use,uber,lot,business,trips,worked,nothing,fancy,special,got,job,done,needed,say,4,stars,back,6-7,years,ago,however,past,weekend,horrible,second,time,trip,prices,fluctuated,wildly,booked,trip,get,airport,45,great,horrible,restart,app,trip,65,annoying,lucked,friend,able,come,give,ride,4:30am,got,airport,flew,state,flew,back,needed,ride,due,unfortunate,unforeseen,circumstances,trip,supposed,60,minute,later,tried,submit,pickup,destination,app,transitioned,back,main,screen,price,100,tried,wanted,get,home,seeing,grandmother,dying,reverted,main,screen,prices,120,cheapest,option,downloaded,lyft,app,paid,50,get,home,using,car,ride,craft,review,going,vote,stars,money,choose,lyft,every,time,uber"
RideHailing,wingz,Unreliable especially if booking with children,10/1/2021 0:34,Pirep101,we pre-booked weeks in advance to get a car with car seats when returning from an international flight at airport. they were a no-show and when we called they said it'd be another hour.,,"pre-booked, weeks in advance, no-show, called, said another hour",,ride experience,,,,FALSE,1,,,16,"pre-booked,weeks,advance,get,car,car,seats,returning,international,flight,airport,no-show,called,said,another,hour"
RideHailing,revel-all-electric-rides,The worst app for rentals,8/7/2021 18:38,nonya676,this app is just a scam tricks you in to fake deals when any average person would buy the final price if stated in beginning instead of trying to double charging people cards if it's 39 dollars for a day pass 42 after taxes it shouldn't be no other charges after that just charge the the card that one time and it won't be an issue,,"scam tricks, fake deals, double charging, not be other charges",,"fraud, payment reliability",,,,FALSE,1,,,34,"app,scam,tricks,fake,deals,average,person,would,buy,final,price,stated,beginning,instead,trying,double,charging,people,cards,39,dollars,day,pass,42,taxes,not,charges,charge,card,one,time,wo,not,issue"
RideHailing,blablacar-carpooling-and-bus,Better than trains,5/3/2022 12:19,amenoph,not only it is a cheaper alternative to planes and trains but often you can find a pick up near where you are. it is impervious to union strikes which plague the sncf every time there's a national vacation period.,"cheaper alternative, find pick up near you, impervious to union strikes",,"affordable, service availability",,,,,FALSE,5,,,18,"cheaper,alternative,planes,trains,often,find,pick,near,impervious,union,strikes,plague,sncf,every,time,national,vacation,period"
RideHailing,lyft,Awesome,6/27/2021 15:30,Mr. San Antonio,i had a wonderful driver very professional,"driver, professional",,ride experience,,,,,FALSE,5,,,3,"wonderful,driver,professional"
RideHailing,curb-the-taxi-app,Never actually finds a taxi,7/17/2021 19:07,CancelParkMobile,"just says ""searching"" forever with estimated time of 1min and gets hung with a spinning wheel. never finds a cab.",,"searching forever, hung with spinning wheel, never find cab",,"app reliability, service availability",,,,FALSE,1,,,15,"says,``,searching,'',forever,estimated,time,1min,gets,hung,spinning,wheel,never,finds,cab"
RideHailing,empower-your-ride-your-way,Only as A Last Resort.,6/19/2022 8:27,Fbdhensksbdh,"if lyft and uber are expensive and or you can't seem to get any drivers within your distance. . . this app does suffice in pricing. but i'm curious, do they even do background checks- forget it.",suffice in pricing,,affordable,,"lyft, uber",,,FALSE,3,,,18,"lyft,uber,expensive,ca,not,seem,get,drivers,within,distance,app,suffice,pricing,curious,even,background,checks-,forget"
RideHailing,moovit-all-transit-options,Helpful,2/20/2021 9:42,Pessimistic Guy,"this app is helpful, you will never believe how helpful it is unless you try it yourself, you'll never get lost with it, no need to ask a stranger who doesn't even speak your language about directions, it's all settled. i love it.","never get lost, no need to ask stranger, ",,ride experience,,,,,FALSE,5,,,20,"app,helpful,never,believe,helpful,unless,try,never,get,lost,need,ask,stranger,not,even,speak,language,directions,settled,love"
RideHailing,uber-request-a-ride,Very bad,3/20/2021 16:49,Batman099,i cannot get rid of this app it keeps bringing in error messages and i cannot change my credit card i've wasted hours trying to get rid of this app there should be a place to illuminate all of the errors in the cloud and let me start fresh i cannot do this,,"cannot get rid of app, keeps brining error messages, not change credit card, wasted hours",,"app reliability, usable",,,,FALSE,1,,,23,"get,rid,app,keeps,bringing,error,messages,change,credit,card,wasted,hours,trying,get,rid,app,place,illuminate,errors,cloud,let,start,fresh"
RideHailing,cabify,Does the job without useless bells and whistles.,2/11/2022 23:16,lguerra50,straight forward application that does the job fast and easy at a time when you need to move from point a to point b and have no time to loose.,"straight forward, does job, fast and easy, no time to loose",,"usable, app reliability",,,,,FALSE,5,,,14,"straight,forward,application,job,fast,easy,time,need,move,point,point,b,time,loose"
RideHailing,veyo-driver,Clients are safer than Uber/Lyft,6/6/2022 15:31,tam99875,"i feel safer as a woman driver using veyo than with the others. definitely no worries about drunk passengers. the app is okay, but it is not safe to make us focus on that checklist before getting directions. half the time, i am on the freeway and cannot pull over.",,"no worries, drunk passengers, not safe, focus on checklist, getting directions",,app reliability,,,,FALSE,4,,,24,"feel,safer,woman,driver,using,veyo,others,definitely,worries,drunk,passengers,app,okay,safe,make,us,focus,checklist,getting,directions,half,time,freeway,pull"
RideHailing,uber-request-a-ride,Uber Eats (Italy),5/30/2022 20:36,MilanItalo,"my uber eats driver delivered the incorrect order to my address. for over 2 hours, i tried to contact uber eats but to no avail. very poor customer service, or should i say absolutely no customer service.",,"delivered, incorrect order, over hours, contact uber, no avail, poor customer service",,"customer service, ride experience",,1,,FALSE,1,,,21,"uber,eats,driver,delivered,incorrect,order,address,2,hours,tried,contact,uber,eats,avail,poor,customer,service,say,absolutely,customer,service"
RideHailing,rapido-indias-bike-taxi,Good and worst experience,3/24/2022 4:39,pondynandy,"i had a good and a worst experience. my first trip was really good. same day i booked a second trip. the guy accepted my trip was more than 20 kilometers away. so he asked to cancel and rebook. i rebooked twice and both the riders were asking about the location and price (95 rupees)
they asked to cancel myself. if they can't ride to location or less amount they should be cancelling and why are they asking me ??",,"asked to cancel and rebook, rebooked twice, riders asking location and price, ",,ride experience,,,,FALSE,3, location,1,38,"good,worst,experience,first,trip,really,good,day,booked,second,trip,guy,accepted,trip,20,kilometers,away,asked,cancel,rebook,rebooked,twice,riders,asking,location,price,95,rupees,asked,cancel,ca,not,ride,location,less,amount,cancelling,asking"
RideHailing,lyft,Easy,7/30/2021 13:23,57King75,"very easy to use, reliable and great service.","easy to use, reliable, great service",,"usable, ride experience",,,1,,FALSE,5,,,5,"easy,use,reliable,great,service"
RideHailing,lyft,Wait and save? More like just wait.,3/23/2021 21:01,PrinceXavier777,been waiting on the wait and save option for over 30 minutes and now i'm late for my doctors appointment i've been planning for weeks. appreciate the support lyft.,,"waiting, wait and save option, over minutes, late for appointment",,app reliability,,,,FALSE,1,,,14,"waiting,wait,save,option,30,minutes,late,doctors,appointment,planning,weeks,appreciate,support,lyft"
RideHailing,wingz,Wingz is Tip notch,7/28/2021 17:19,cat66kuke,"excellent service, will always use!",,,,,,,,FALSE,5,,,4,"excellent,service,always,use"
RideHailing,ztrip,Last letter of the alphabet for a reason!,8/18/2021 20:34,BoricuaMI,"called for a pick up at 8:59pm, i called to get an eta at 10:52pm, at 11:02pm the order was placed again without me saying anything! at 12:19am driver calls and asks if i still needed a ride?!!! i don't understand how you can bid on contracts and not have drivers ready to work!? you are not: yellow cab, uber, checkered taxi or lyft!",,"order placed again, without saying, driver calls, asks needed ride",,app reliability,"yellow cab, uber, checkered taxi, lyft",,,FALSE,1,,,33,"called,pick,8:59pm,called,get,eta,10:52pm,11:02pm,order,placed,without,saying,anything,12:19am,driver,calls,asks,still,needed,ride,not,understand,bid,contracts,drivers,ready,work,yellow,cab,uber,checkered,taxi,lyft"
RideHailing,lyft,I never get discounts,6/8/2021 15:55,deedee265,i use lyft pretty often and pay a good amount for my rides and i never received any discounts,,,,,,,,FALSE,3,,,11,"use,lyft,pretty,often,pay,good,amount,rides,never,received,discounts"
RideHailing,beat-ride-app,Tough to find rides,2/16/2022 21:42,deviously,"every city we've visited in colombia, it's tough to get a ride via beat. it's actually illegal, so drivers will only take long rides and try to cancel and get you to pay outside of the app. also, if you cancel a request before it links to a driver, about 70% of the time the request still goes through and a driver shows up.",,"tough to get ride, illegal, drivers take long rides, try to cancel, get to pay outside, cancel request, request still goes through, drivers shows up",,"app reliability, ride experience, service availability",,,,FALSE,3,,,33,"every,city,visited,colombia,tough,get,ride,via,beat,actually,illegal,drivers,take,long,rides,try,cancel,get,pay,outside,app,also,cancel,request,links,driver,70,time,request,still,goes,driver,shows"
RideHailing,blue-bird-group-taxi-mobile,EasyRide not working,2/13/2021 1:19,Bprijadi,i have chatted to bluebird customer service staff via the app because of this inconveniences. i had no cash at the time and needed badly the easyride feature backing me up. i was let down even when i had sufficient funds going back home (estimated rp 31000 vs rp 136000 e-wallet available fund),,"chatted, customer service staff, inconveniences, no cash, let down, had sufficient funds",,customer service,,,,FALSE,1,,,31,"chatted,bluebird,customer,service,staff,via,app,inconveniences,cash,time,needed,badly,easyride,feature,backing,let,even,sufficient,funds,going,back,home,estimated,rp,31000,vs,rp,136000,e-wallet,available,fund"
RideHailing,lyft,Rodger,1/18/2022 16:20,Myers Gilmer,great all around driver!!!,,,,,,,,FALSE,5,,,3,"great,around,driver"
RideHailing,lyft,Not always so good on the app side,5/7/2022 23:58,das in Phoenix,the app gave me directions to meet the driver - each of three times the location did not exist.,,"directions, meet driver, location not exist",,app reliability,,,,FALSE,3, location,1,9,"app,gave,directions,meet,driver,three,times,location,exist"
RideHailing,lyft,The worst!,4/28/2022 0:37,penguin@2021,every time i request a ride i have to wait 40 mins. i run late even even i request it an hour before my shift. i get a ride then it gets canceled and have to wait another 15 mins to find another driver. ridiculous!,,"request ride, have to wait mins, run late, request an hour before, get ride, gets canceled, have to wait, find another driver, ridiculous",,ride experience,,1,,FALSE,1,,,26,"every,time,request,ride,wait,40,mins,run,late,even,even,request,hour,shift,get,ride,gets,canceled,wait,another,15,mins,find,another,driver,ridiculous"
RideHailing,grab-superapp,Unreliable overpriced,5/28/2022 11:08,hyperzx,"app is so unreliable at getting taxis in bangkok, sometimes the taxi stays in one spot for 30 min making you late and doesn't rebook you",,"unreliable, getting taxis, stays in one spot, making you late, not rebook",,"ride experience, app reliability",,1,,FALSE,1,,,16,"app,unreliable,getting,taxis,bangkok,sometimes,taxi,stays,one,spot,30,min,making,late,not,rebook"
RideHailing,kakao-t,Fair and objective review,3/17/2022 12:33,1980style,kakao app is a monopoly that has grown fat and inefficient to the extent is doesn't care about it's consumer and only cares about it's share price and profit numbers. they collect so much personal information and share it with the korean socialist government. this is not a good platform.,,"monopoly, inefficient, not care consumer, cares share price and profit numbers, collect personal information, share with korean socialist government",,"affordable, data privacy",,,,FALSE,1,personal info,1,25,"kakao,app,monopoly,grown,fat,inefficient,extent,not,care,consumer,cares,share,price,profit,numbers,collect,much,personal,information,share,korean,socialist,government,good,platform"
RideHailing,lyft,Great App.,2/11/2022 23:49,Boracayman,i love it when i can get an estimate on an app.,,,,,,,,FALSE,5,,,4,"love,get,estimate,app"
RideHailing,moovit-all-transit-options,The worst service ever,6/1/2021 23:43,caritolro,"the drivers are the worst costumer service that  nj transit has . they don't have any respect for the old people for anyone they are so rude and they are so  not respectful for drive and answer any information . only because is necessary take this service is why people do it , but really doesn't worth.",,"worst costumer service, not have respect, old people, rude, not respectful, not answer information, not worth",,ride experience,,1,,FALSE,1,,,23,"drivers,worst,costumer,service,nj,transit,not,respect,old,people,anyone,rude,respectful,drive,answer,information,necessary,take,service,people,really,not,worth"
RideHailing,bolt-fast-affordable-rides,Good,4/15/2021 5:09,tazo kereselidze,"it is very good application for taxi orders download it and
enjoy it",,,,,,,,FALSE,5,,,6,"good,application,taxi,orders,download,enjoy"
RideHailing,lyft,Why are you asking for my driver's license?,7/29/2021 1:45,j CD x ad,"seems a little counter-productive to ask a user for their drivers license when they are trying to use an app to help them get around places that they are asking someone else to drive for them.

lyft app is over here asking me for my driver's license id in order to login to the rider app. i've been using lyft app since it started why did it loose my login. and also why are you asking me for my id. i downloaded the lyft app so i could get a ride.",,"counter-productive, ask user, driver license, trying to use",,usable,,,,FALSE,1,,,44,"seems,little,counter-productive,ask,user,drivers,license,trying,use,app,help,get,around,places,asking,someone,else,drive,lyft,app,asking,driver,license,id,order,login,rider,app,using,lyft,app,since,started,loose,login,also,asking,id,downloaded,lyft,app,could,get,ride"
RideHailing,99-private-drivers-and-taxi,Can't retrieve my email,11/6/2021 18:27,PNC.406,your security is pathetic. you allow users to use whatever email they chose without any authentication. someone in brazil is using my email and i can't stop this. i have tried calling your company with no success. your company is pathetic,,"security, pathetic, allow users, use whatever email, without authentication, calling company, no success,",,"customer service, security",,,,FALSE,1,,,23,"security,pathetic,allow,users,use,whatever,email,chose,without,authentication,someone,brazil,using,email,ca,not,stop,tried,calling,company,success,company,pathetic"
RideHailing,lyft,Can we edit pickup times?,1/2/2022 16:58,Gnarlyharly,"while our driver was excellent, we had wanted to change the pickup time , but could not do that. can y'all change that?",,"change pickup time, not do",,usable,,,,FALSE,5,,,9,"driver,excellent,wanted,change,pickup,time,could,y,change"
RideHailing,uber-request-a-ride,Driver never showed up,12/18/2021 1:15,Selene Moon Rise,"we booked a car for 4:45 and the driver didn't show up, we had to catch a flight and if we waited for the car to arrive we would have missed it. we were still charged for the cancellation which seems unfair considering the circumstance. would really love a refund!",,"driver not show up, charged for cancellation, seems unfair, ",,"ride experience, payment reliability",,,,FALSE,2,,,24,"booked,car,4:45,driver,not,show,catch,flight,waited,car,arrive,would,missed,still,charged,cancellation,seems,unfair,considering,circumstance,would,really,love,refund"
RideHailing,cabify,Not allowed to use the app for an hour,7/2/2022 17:06,foscoe944,"i downloaded the app to order a taxi, but the app says i cannot order one for 59 minutes. ",,"cannot order, minutes",,service availability,,,,FALSE,1,,,10,"downloaded,app,order,taxi,app,says,order,one,59,minutes"
RideHailing,uber-request-a-ride,Poor everything,4/6/2021 2:17,Swimsnycs1313,cars are never available. when they are wait times and prices are insane. what's worse is customer service. just makes flimsy excuses and continues to tell you you're wrong. lyft is much better in the long run.,,"never available, wait times and prices insane, worse customer service, flimsy excuses, tell wrong, ",,"service availability, affordable, customer service",lyft,,,FALSE,1,,,21,"cars,never,available,wait,times,prices,insane,worse,customer,service,makes,flimsy,excuses,continues,tell,wrong,lyft,much,better,long,run"
RideHailing,lyft,Unpredictable rate structure,6/6/2022 20:06,Kludj,"i set up a car last night to pick me up this morning for a ride to airport. 5 minutes before pick up a person calls and says they are 45 minutes away. i had to cancel that and got another.
it said 48.00 but halfway to the airport it said $222.00. 
not happy!",,,,"payment reliability, ride experience",,,,FALSE,3,,,27,"set,car,last,night,pick,morning,ride,airport,5,minutes,pick,person,calls,says,45,minutes,away,cancel,got,another,said,48.00,halfway,airport,said,222.00,happy"
RideHailing,bolt-fast-affordable-rides,Not reliable.,2/28/2022 10:06,BigBadBoston,"4 out of 5 rides i attempt get cancelled. cannot be counted upon, sadly. at least in paris nor london",,"attempt, cancelled",,ride experience,,,,FALSE,1,,,12,"4,5,rides,attempt,get,cancelled,counted,upon,sadly,least,paris,london"
RideHailing,blue-bird-group-taxi-mobile,Super helpful app,8/12/2022 23:52,njkasia,app is easy to use. provided detailed location of driver. was able to to arrange even if paying by cash!,"easy to use, detailed location, able to arrange, paying by cash",,"usable, app reliability",,,,,FALSE,5, location,1,12,"app,easy,use,provided,detailed,location,driver,able,arrange,even,paying,cash"
RideHailing,lyft,Continuing errors,7/5/2021 2:37,unknown,"it's not an application for drivers, but license authentication appears:(",,,,,,,,FALSE,1,,,5,"application,drivers,license,authentication,appears"
RideHailing,bolt-fast-affordable-rides,Like Uber,7/8/2021 8:03,Kukolka Jasmin,"i like this app.easy to use,very convenient and good prices.great servises as well!","easy to use, convenient, good prices, great services",,"usable, affordable",,,,,FALSE,5,,,8,"like,app.easy,use,convenient,good,prices.great,servises,well"
RideHailing,revel-all-electric-rides,Fun and zippy!,3/31/2021 18:08,wezwells,these things are faster than my motorcycle over the first few metres so be careful. great way to get around the city.,,,,,,,,FALSE,5,,,11,"things,faster,motorcycle,first,metres,careful,great,way,get,around,city"
RideHailing,ztrip,Don't Use!,1/15/2022 22:15,AngMar1120,"this is a horrible company and not user friendly. phone numbers on the website are incorrect. if you book in advance, you will not be notified if your ride is not picked up. you'll be waiting, then call the contact number and then be told they don't service your area and give you a new phone number you have to memorize on the spot. they have no answer as to why notifications are not sent and are extremely unhelpful.",,"not user friendly, phone numbers, incorrect, book in advance, not notified, ride not picked up, call contact number, phone number, memorize on spot, no aswer to notifications, extremely unhelpful",,"customer service, app reliability, ",,1,,FALSE,1,,,32,"horrible,company,user,friendly,phone,numbers,website,incorrect,book,advance,notified,ride,picked,waiting,call,contact,number,told,not,service,area,give,new,phone,number,memorize,spot,answer,notifications,sent,extremely,unhelpful"
RideHailing,kakao-t,Not for tourists,12/11/2021 23:36,Polpoteus,only available for those with a korean residency number/korean bank account.,,,,service availability,,1,,FALSE,1,,,6,"available,korean,residency,number/korean,bank,account"
