Domain,Name,Title,Date,UserName,Review,Positive keywords,Negative keywords,Positive genre,Negative genre,Talk about other apps,e.g.,remarks,isEdited,Rating,keyword,selected,Word count,Extracted words
RideHailing,via-low-cost-ride-sharing,Great music!,5/18/2021 4:59,sozueeeen,great driver ! great choice of music !,,,,,,,,FALSE,5,,,5,"great,driver,great,choice,music"
RideHailing,rapido-indias-bike-taxi,Insensitive,5/30/2022 7:50,shappul,some drivers are good but some are insensitive and dropped us on the road saying that the map showed only till there. we were actually just 1000 steps away to the destination and requested him to just go a little bit further but he was so rude and told us that he won't go even a step further.,,"insensitive, dropped us on road, just steps away from, requested to go little bit further, rude, not go step further",,ride experience,,,,FALSE,5,,,27,"drivers,good,insensitive,dropped,us,road,saying,map,showed,till,actually,1000,steps,away,destination,requested,go,little,bit,rude,told,us,wo,not,go,even,step"
RideHailing,ola-cabs,Harassers,8/17/2022 3:06,ps3hs,they keep calling you to make the payments for the rides that you never availed!,,"keep calling, make payments, rides never availed",,payment reliability,,,,FALSE,1,,,7,"keep,calling,make,payments,rides,never,availed"
RideHailing,lyft,Slower service,3/18/2021 19:41,sergio310,"lately takes forever to get a ride if at all, while the price has shot up! its downright awful lately. last night was forced to walk home due to no pick up. horrible dependency",,"takes forever, get ride, price shot up, downright awful, forced to walk, no pickup, horrible dependency",,"app reliability, affordable, ride experience",,,,FALSE,5,,,19,"lately,takes,forever,get,ride,price,shot,downright,awful,lately,last,night,forced,walk,home,due,pick,horrible,dependency"
RideHailing,bolt-fast-affordable-rides,Deductions,2/18/2022 8:12,dudebraib,i was debited unaware and yet to be reimbursed since december 2021. useless app,,"debited unaware, yet to be reimbursed, useless",,payment reliability,,,,FALSE,1,,,9,"debited,unaware,yet,reimbursed,since,december,2021.,useless,app"
RideHailing,curb-the-taxi-app,Doesn't work consistently,6/8/2021 23:11,Unhappy Chicagoan,i recently found out about this app and was extremely happy... until i used it more and found it's a crap shoot when it works. 70% of the time i get an error when booking and i'm in downtown chicago so i doubt it's an issue with availability.,,"crap shoot, error when booking, issue with availability",,"app availability, app reliability",,,,FALSE,2,,,21,"recently,found,app,extremely,happy,...,used,found,crap,shoot,works,70,time,get,error,booking,downtown,chicago,doubt,issue,availability"
RideHailing,moovit-all-transit-options,Greatest app ever,1/21/2022 15:39,happyzan,"used it on my very first time to nyc and made me look like a pro using the subway, used it again when a big group of us went to nyc again after 2 years and it got us where we needed to go. love this app.","made look like pro, got where needed",,"usable, ride experience",,,,,FALSE,5,,,24,"used,first,time,nyc,made,look,like,pro,using,subway,used,big,group,us,went,nyc,2,years,got,us,needed,go,love,app"
RideHailing,empower-your-ride-your-way,Comfortable ride,6/6/2022 11:55,unique@2,awesome driver very professional,"driver, professional",,ride experience,,,,,FALSE,5,,,3,"awesome,driver,professional"
RideHailing,uber-request-a-ride,No option to verify ride with PIN,11/18/2021 7:26,JavaBean101,"have tried for over an hour to troubleshoot why there is no option to verify my ride with pin within the settings of my app. nothing in the help section addresses this. all searches for help give these steps: 1. open the app.

2. go to ""settings"". 3. tap ""verify your ride"". there is nothing that says verify your ride anywhere!!!  yes, i have updated the app. such a waste of time!!! will be using lyft from now on.",,"tried over hour, troubleshoot, no option, verify , ride with pin, nothing in help section, updated app, waste of time",,"usable, app reliability",,,,FALSE,1,,,44,"tried,hour,troubleshoot,option,verify,ride,pin,within,settings,app,nothing,help,section,addresses,searches,help,give,steps,1.,open,app,2.,go,``,settings,'',3.,tap,``,verify,ride,'',nothing,says,verify,ride,anywhere,yes,updated,app,waste,time,using,lyft"
RideHailing,revel-all-electric-rides,Too expensive,12/15/2020 19:02,Jonnyb08,"great concept. fun to ride, but too costly. literally cheaper to take an uber..","fun to ride, ",too costly,ride experience,affordable,uber,,,FALSE,3,,,10,"great,concept,fun,ride,costly,literally,cheaper,take,uber,.."
RideHailing,ztrip,Avoid using,6/25/2022 11:35,Rex_Hardo,booked a taxi 12 hours in advance. taxi showed up 45 minutes late and i had to call the indian call center to get any action on the taxi coming to get me,,"booked hours in advance, showed minutes late, call , call center, ",,app reliability,,,,FALSE,1,,,19,"booked,taxi,12,hours,advance,taxi,showed,45,minutes,late,call,indian,call,center,get,action,taxi,coming,get"
RideHailing,ado-boletos-de-autob%C3%BAs,"Generally good app, has bugs.",7/29/2021 18:22,choogiesaur,"paypal payment never works. i have an ado account created, logged in to my paypal, selected all my available cards to try to pay, always get error message like error de pagar con paypal. regular card payment workssometimes. when everything works, all is fine.

i ask a favor of the devs: fix paypal integration :)

and a suggestion for a feature: determine a series of bus trips to get from point a to point b. for example, i want to go from palenque to oaxaca. the app would search and find a route for me from palenque to crdenas, then from crdenas to oaxaca. you don't have to make the customer buy the whole route, but just have a suggestion of possible stops to get to the destination. if there was a feature like this, i would be likely to use ado for all my travel in mexico. :)",,"paypal payment, never works, always get error, regular payment , work sometime, fix paypal integration, ",,app reliability,,1,,FALSE,3,,,80,"paypal,payment,never,works,ado,account,created,logged,paypal,selected,available,cards,try,pay,always,get,error,message,like,error,de,pagar,con,paypal,regular,card,payment,workssometimes,everything,works,fine,ask,favor,devs,fix,paypal,integration,suggestion,feature,determine,series,bus,trips,get,point,point,b.,example,want,go,palenque,oaxaca,app,would,search,find,route,palenque,crdenas,crdenas,oaxaca,not,make,customer,buy,whole,route,suggestion,possible,stops,get,destination,feature,like,would,likely,use,ado,travel,mexico"
RideHailing,lyft,Watch your price,7/29/2021 15:21,The Professional Driver,"i put in the exact address and the lyft had the driver take us to a residence the driver even put in the required address and lyft still gave the wrong address once the driver had to put into his google to get lyft to give correct address. 
i should not be charged.",,"gave, wrong address, should not be charged",,app reliability,,,,FALSE,5,,,27,"put,exact,address,lyft,driver,take,us,residence,driver,even,put,required,address,lyft,still,gave,wrong,address,driver,put,google,get,lyft,give,correct,address,charged"
RideHailing,ztrip,Less Than One Star,11/11/2021 9:46,@Highwayvagabond,crooked company all the way around. good luck getting a ride much less on time with an appointment also. i needed to make a short stop at a cstore and the driver left me ! i called for a second driver and was told they were too busy. never again !,,"crooked company, good luck, getting ride, driver left, called second driver, told too busy",,"ride experience, service availability, fraud",,1,,FALSE,1,,,26,"crooked,company,way,around,good,luck,getting,ride,much,less,time,appointment,also,needed,make,short,stop,cstore,driver,left,called,second,driver,told,busy,never"
RideHailing,wingz,Fantastic communication and ride!,9/22/2021 18:12,JHP Berkeley,"really a great service!!  excellent communication, very prompt, courteous, and comfortable ride!  frank is great!  so glad wingz is there!","great service, communication, prompt, courteous, comfortable ride, ",,"ride experience, ",,,,,FALSE,5,,,13,"really,great,service,excellent,communication,prompt,courteous,comfortable,ride,frank,great,glad,wingz"
RideHailing,uber-request-a-ride,Trip tonight,12/4/2020 1:57,errttyyuuioooolkkjgfddsa13457,how horrible you are jesus was on his way he canceled we couldn't call him we've missed our flight with southwest airlines i have saved the information both on his statement saying he'd be here in three minutes him canceling on us right before we needed to leave and the flight we missed with southwest airlines this will go on better business bureau and we will no longer need you,,"horrible, canceled, could not call, missed flight, ",,ride experience,,1,,FALSE,2,,,32,"horrible,jesus,way,canceled,could,not,call,missed,flight,southwest,airlines,saved,information,statement,saying,three,minutes,canceling,us,right,needed,leave,flight,missed,southwest,airlines,go,better,business,bureau,longer,need"
RideHailing,didi-rider-affordable-rides,Using this app exposes you to china security laws,12/4/2021 4:46,Rawckus,your information will be shared with the chinese government. in addition using this app is basically supporting the ccp(chinese communist party). doing that probably isn't a good idea for anyone.,,"information shared, chinese governmetn, supporting ccp",,data privacy,,,,FALSE,2,,,18,"information,shared,chinese,government,addition,using,app,basically,supporting,ccp,chinese,communist,party,probably,not,good,idea,anyone"
RideHailing,lyft,Not that many drivers,9/26/2021 16:59,bigfqt att,everytime i order a lyft there's never no drivers when i do get a driver then cancel on me because i'm too far i don't get it at all i'm not to happy about this app where i live all drivers should be on a schedule,,"never drivers, get driver, cancel on me, too far, not happy, ",,"ride experience, service availability",,,,FALSE,3,,,16,"everytime,order,lyft,never,drivers,get,driver,cancel,far,not,get,happy,app,live,drivers,schedule"
RideHailing,bolt-fast-affordable-rides,Poor,2/23/2021 21:18,dumapointluuk,can't even accept my cc on my account,,,,,,,,FALSE,5,,,6,"ca,not,even,accept,cc,account"
RideHailing,lyft,Drivers,1/25/2021 10:50,Tayy.Millie,need more late night/early morning drivers; i work at 6a and it's hard getting drivers sent to my house during those hours and a lot of times i'm late for work because i constantly have to wait for drivers to be available in my area !,,"need more late, night/early drivers, hard getting drivers, late for work, constantly wait, available in my area",,service availability,,,,FALSE,3,,,22,"need,late,night/early,morning,drivers,work,6a,hard,getting,drivers,sent,house,hours,lot,times,late,work,constantly,wait,drivers,available,area"
RideHailing,ztrip,"Left a 80 yr old women, with no ride home.",5/25/2022 15:32,Bolleman48,"so my 80 yr old, wheelchair bound mother books a ride days in advance. (with the handy capable van).driver shows up late for the pick up. can't hardly speak english. then never shows to pick her back up. called customer service. and like every other customer service hotline in this country. she couldn't understand the women on the other end of the line. in the end we're looking for a driver ma'am. as she waited in the cold on the curb. there is no accountability!!! we canceled all further rides. funny thing was. they didn't show the other three rides that were booked last week! don't bother with these folks! it's expensive and poor customer service, with no answers. they'll show up late and then forget to come get you. meantime they'll clean out your wallet for 50 dollar ride 3 miles.",,"wheelchair bound, book ride, days in advance, handy capable, driver, shows up late, hardly speak english, never shows to pick up, called customer service, not understand, no accountability, canceled rides, not show rides that were booked, don't bother, expensive, poor customer service, no answers, show up late, forget to come get you, clean out wallet",,"ride experience, affordable, fraud, customer service",,,,FALSE,1,,,81,"80,yr,old,wheelchair,bound,mother,books,ride,days,advance,handy,capable,van,.driver,shows,late,pick,ca,not,hardly,speak,english,never,shows,pick,back,called,customer,service,like,every,customer,service,hotline,country,could,not,understand,women,end,line,end,looking,driver,ma,waited,cold,curb,accountability,canceled,rides,funny,thing,not,show,three,rides,booked,last,week,not,bother,folks,expensive,poor,customer,service,answers,show,late,forget,come,get,meantime,clean,wallet,50,dollar,ride,3,miles"
RideHailing,moovit-all-transit-options,TOP NOTCH ,5/14/2022 23:10,Brieaux__,suuuper great navigational transit application,,,,,,,,FALSE,5,,,5,"suuuper,great,navigational,transit,application"
RideHailing,moovit-all-transit-options,Patricia,5/6/2021 14:27,Sinsaychanel1,most accurate by far! i love this app! ,most accurate,,app reliability,,,,,FALSE,5,,,4,"accurate,far,love,app"
RideHailing,cabify,"Good, BUT",7/31/2022 18:02,Pierce88364,"the app is relatively simple to use and it worked very well except for one vital function. the map! there was no accuracy with the map and at one point we had to guide our driver step-by-step via chat. not the biggest deal in the world, but considering this is a location based ride service, you should fix the map.","simple to use, worked well","vital function, map, no accuracy. had to guide driver, step-by-step via chat, not biggest deal, location based ride service, fix the map",usable,app reliability,,,,FALSE,3, location,1,30,"app,relatively,simple,use,worked,well,except,one,vital,function,map,accuracy,map,one,point,guide,driver,step-by-step,via,chat,biggest,deal,world,considering,location,based,ride,service,fix,map"
RideHailing,waze-carpool,Does not work,7/11/2022 17:02,nampramos,"app doesn't work. can't go past phone number registration. says check my internet connection. force close the app and then try to find a ride, but can't edit from location. useles.",,"app, not work, not go past registration, check internet connection, force close, find ride, not edit location, useless",,"usable, app reliability",,,,FALSE,1, location,1,25,"app,not,work,ca,not,go,past,phone,number,registration,says,check,internet,connection,force,close,app,try,find,ride,ca,not,edit,location,useles"
RideHailing,lyft,Perfect ride.,5/24/2022 4:25,canofpicante,it was like hiring a pro driver at dulles for half the cost. mohammed was super friendly and welcoming.,"hiring, pro driver, half the cost, super friendly, welcoming",,"ride experience, affordable",,,1,,FALSE,5,,,11,"like,hiring,pro,driver,dulles,half,cost,mohammed,super,friendly,welcoming"
RideHailing,ola-cabs,Disgusting experience,8/25/2022 1:33,viralshetty,the driver was impolite and rude. no hygiene (filthy) was maintained inside the car. he didn't use air conditioning though it was hot outside. please check review even before getting into his car.,,"driver, impolite, rude, no hygiene, filthy, not use air conditioning, hot outside, check review, ",,ride experience,,,,FALSE,1,,,21,"driver,impolite,rude,hygiene,filthy,maintained,inside,car,not,use,air,conditioning,though,hot,outside,please,check,review,even,getting,car"
RideHailing,wingz,Only app I use for flights!,8/28/2021 14:50,Shannondefrance,been a customer since they launched in portland. so glad they survived the pandemic because i literally never want to use any other ride share app - especially for travel!! wingz is the best and davinder is the best driver in portland!,,,,,,,,FALSE,5,,,22,"customer,since,launched,portland,glad,survived,pandemic,literally,never,want,use,ride,share,app,especially,travel,wingz,best,davinder,best,driver,portland"
RideHailing,via-low-cost-ride-sharing,Love VIA,6/7/2022 22:00,michyale3,easy to use! friendly service!,"easy to use, friendly service",,"usable, ride experience",,,,,FALSE,5,,,4,"easy,use,friendly,service"
RideHailing,moovit-all-transit-options,The Best,5/11/2022 12:10,SuzetteInell,"i'm a motorist and rarely take public transportation. however, when i need to use the bus and train this moovit helps great deal. it's always accurate with the eta and keeps you updated throughout your commute. love it!!","always accurate, keeps update, throughout commute",,app reliability,,,,,FALSE,5,,,22,"motorist,rarely,take,public,transportation,however,need,use,bus,train,moovit,helps,great,deal,always,accurate,eta,keeps,updated,throughout,commute,love"
RideHailing,blablacar-carpooling-and-bus,comment,7/27/2021 11:14,cicekliyar,"anwsering time must be shorter. 
when we make reservation as passenger, we wait too long gor driver's answer.",,"wait too long, driver answer",,ride experience,,,,FALSE,4,,,12,"anwsering,time,must,shorter,make,reservation,passenger,wait,long,gor,driver,answer"
RideHailing,revel-all-electric-rides,Horrendous app,3/28/2021 21:39,Serenya76,i've been taking their quiz/test for the past 20 minutes. i've answered the same dumb question at least 4 times and yet i'm still note done. rented a scooter within 30 seconds and just went on my way.,,"answered dumb question, still not done,",,usable,,1,,FALSE,1,,,22,"taking,quiz/test,past,20,minutes,answered,dumb,question,least,4,times,yet,still,note,done,rented,scooter,within,30,seconds,went,way"
RideHailing,didi-rider-affordable-rides,No customer service,1/30/2022 21:53,ndhdhwhwvdvksjsjfhidif,thought all was good with this app.    used a few months and no issue.   then a delivery guy kept my food. never delivered and could not get a refund.   no one answers the chats or emails.   be careful using this app.,,"delivery guy, kept food, never delivered, not get refund, no one answeres, chats or emails, be careful",,"ride experience, customer service, payment reliability",,,,FALSE,2,,,22,"thought,good,app,used,months,issue,delivery,guy,kept,food,never,delivered,could,get,refund,one,answers,chats,emails,careful,using,app"
RideHailing,gett-business-ground-travel,I have usually found it helpful,8/15/2022 10:06,Savannah Zev,"one time, i had a difficult experience.  however, the last time was great again",,,,,,,,FALSE,4,,,8,"one,time,difficult,experience,however,last,time,great"
RideHailing,grab-superapp,Driver quick responses,6/12/2022 8:32,Andrew Hrang Dun,drivers  usually pick up the calls too soon often but they often cancel again.,,"pick up calls, too soon, often cancel",,ride experience,,,,FALSE,3,,,8,"drivers,usually,pick,calls,soon,often,often,cancel"
RideHailing,blablacar-carpooling-and-bus,Zero cars if you choose English,8/28/2022 7:23,J$7,this app is terrible. shows zero cars if you choose english uk. while there are dozens in ukraine to warsaw.,,"shows zero cars, dozens in ukraine",,"service availability, app reliability",,,,FALSE,1,,,11,"app,terrible,shows,zero,cars,choose,english,uk,dozens,ukraine,warsaw"
RideHailing,blablacar-carpooling-and-bus,How can change currency,11/4/2021 12:43,tatuuu555,gow we can change currency,,,,,,,,FALSE,1,,,3,"gow,change,currency"
RideHailing,uber-request-a-ride,App is to difficult to use.,12/14/2021 18:20,Sakii20,"i have an older phone and the app was so confusing that i went with another company. 
i've used uber before in texas and had no issues. 
what happened to the app?",,"app, confusing, no issues",,usable,,,,FALSE,1,,,13,"older,phone,app,confusing,went,another,company,used,uber,texas,issues,happened,app"
RideHailing,lyft,Outstanding,12/19/2020 14:17,Pooh5121,david was extremely nice and helpful with my shopping bags in and out of the car. would definitely recommend him again for a driver.,,"nice and helpful, definitely recommend",,ride experience,,,,FALSE,5,,,11,"david,extremely,nice,helpful,shopping,bags,car,would,definitely,recommend,driver"
RideHailing,uber-request-a-ride,Terrible reliability & customer service!,5/29/2021 15:45,Psychor,"scheduled a ride for picking at x about 35 min. prior to x. come time for pickup and even 10 min. after there no driver assigned.

you want to call or chat someone for help? good luck - it doesn't exist.",,"scheduled ride, no driver assigned, want to call or chat, not exist",,"customer service, app reliability",,1,,TRUE,1,,,25,"scheduled,ride,picking,x,35,min,prior,x.,come,time,pickup,even,10,min,driver,assigned,want,call,chat,someone,help,good,luck,not,exist"
RideHailing,veyo-driver,App issues,3/11/2021 4:13,number one2,"i tap on the icon to navigate to the address and the gps of my choice can not open up.
the gps app i chose works jest fine any other time.
when i change to a different gps app and tap on the map icon to use it it works jest fine but y'all pay us based on how google maps says to get there at least that's what i was told .so i don't use iphone maps to take a pax home. other than that i like the app ok.",,,,,,,,FALSE,5,,,46,"tap,icon,navigate,address,gps,choice,open,gps,app,chose,works,jest,fine,time,change,different,gps,app,tap,map,icon,use,works,jest,fine,y,pay,us,based,google,maps,says,get,least,told,.so,not,use,iphone,maps,take,pax,home,like,app,ok"
RideHailing,lyft,Very few drivers,8/20/2021 22:45,bumebea,"i'm not sure what has happened over this past year with lyft and uber, but there are hardly ever drivers anymore. i doubt that covid is affecting the amount of drivers now when there were so many during lockdown. it's ridiculous to have to wait 10-20 minutes for a ride that costs more than $20 (when they use to cost 7-8 max).",,"hardly ever drivers, ridiculous, wait minutes",,"service availability, ride experience",,,,FALSE,2,,,28,"sure,happened,past,year,lyft,uber,hardly,ever,drivers,anymore,doubt,covid,affecting,amount,drivers,many,lockdown,ridiculous,wait,10-20,minutes,ride,costs,20,use,cost,7-8,max"
RideHailing,lyft,THE worst,8/17/2021 20:42,Hannahless,don't ever use lyft! their drivers will charge you a damage fee for no reason at all and the customer service will not help out.,,"drivers, charge damage fee for no reason, customer service, not help out",,"payment reliability, customer service",,,,FALSE,1,,,12,"not,ever,use,lyft,drivers,charge,damage,fee,reason,customer,service,help"
RideHailing,lyft,A blessing in disguise...,12/13/2020 8:14,Spidersites,my driver was amazing. she picked me up without judging me for being slightly intoxicated. what an interesting conversation driving home. she kept me awake and laughing at her witty conversation. i hope i see her again.,,"picked up, without judging, interesting conversation, kept awake, laughing, witty conversation",,ride experience,,,,FALSE,5,,,18,"driver,amazing,picked,without,judging,slightly,intoxicated,interesting,conversation,driving,home,kept,awake,laughing,witty,conversation,hope,see"
RideHailing,lyft,Notifications,7/19/2021 17:35,Jff0924,i'm past several rides i have not been getting any notifications when i'm scheduling rides for my sister,,"not getting notifications, scheduling rides",,app reliability,,,,FALSE,3,,,8,"past,several,rides,getting,notifications,scheduling,rides,sister"
RideHailing,lyft,Blatantly Partisan Company Not Worth Supporting,9/4/2021 20:06,Nathan M Berning,"blatantly political organization that doesn't even bother to remember that half of their users disagree with them. as a pro-lifer, sadly i can no longer user lyft, which was my favorite ride sharing app up to this point. stay in your lane!",,,,,,,,FALSE,1,,,22,"blatantly,political,organization,not,even,bother,remember,half,users,disagree,pro-lifer,sadly,longer,user,lyft,favorite,ride,sharing,app,point,stay,lane"
RideHailing,lyft,So convenient and easy to use,6/14/2021 21:54,Kris_loves_words,app makes it easy to use.,easy to use,,usable,,,,,FALSE,5,,,4,"app,makes,easy,use"
RideHailing,lyft,Daler,3/23/2021 16:20,cybelea,awesome service and friendly driver! thank you!,"awesome service, friendly driver",,ride experience,,,,,FALSE,5,,,5,"awesome,service,friendly,driver,thank"
RideHailing,hopskipdrive,Can't schedule a ride,3/8/2021 16:30,The end of apple.........,wanted to try this out and can't book a ride 3 days in advance. either the service is available in your area or it's not. if you can't book 3 days in advance it's not available!,,"cant book ride, days in advance, service available or not, ",,"app reliability, service availability",,,,FALSE,1,,,20,"wanted,try,ca,not,book,ride,3,days,advance,either,service,available,area,ca,not,book,3,days,advance,available"
RideHailing,uber-request-a-ride,Crashes constantly for Jump bikes,8/28/2021 7:30,Stephan092,i am getting so fed up walking 10 minutes to get to a jump bike and having this app crash when i try to unlock it. stop wasting my time. totally disappointing and i always then need to figure out another way to get home,,"fed up walking, app crash, try to unlock, need to figure out, another way home",,app reliability,,,,FALSE,1,,,24,"getting,fed,walking,10,minutes,get,jump,bike,app,crash,try,unlock,stop,wasting,time,totally,disappointing,always,need,figure,another,way,get,home"
RideHailing,lyft,Appreciation and Satisfaction,3/13/2022 17:24,LuWih123,"i wrote this to show my satisfaction to all the drivers who had driven me to my destination, especially their attitude to customers.",,,,,,,,FALSE,5,,,9,"wrote,show,satisfaction,drivers,driven,destination,especially,attitude,customers"
